{
  "schema_version": 1,
  "ruleset_id": "brp_ugc",
  "ruleset_name": "Basic Roleplaying: Universal Game Engine",
  "source": "Basic Roleplaying: Universal Game Engine - Handouts Pack (Chaosium Inc., 2023, ISBN 978-1-56882-470-3)",
  "licence": "Open RPG Creative License (ORC). This product is licensed under the ORC License (Chaosium Inc., 2023) and is available for personal and commercial use. Basic Roleplaying is a trademark of Chaosium Inc.; this is a fan-made reference data file for RPG-OS, not affiliated with or endorsed by Chaosium Inc.",
  "comment": "Fan transcription of the Basic Roleplaying: Universal Game Engine Handouts Pack (Chaosium, 2023, ORC-licensed) for RPG-OS. Attributes are the eight characteristics (STR CON SIZ INT POW DEX APP EDU, 3-18 scale) plus Luck and Sanity. Derived stats: Max Hit Points = ceil((CON+SIZ)/2), Max Power Points = POW, each characteristic's x5 value (for characteristic rolls, e.g. STR_5 = STR*5), and the combat abstractions Attack (= Brawl), Parry (= Dodge) and Initiative (= DEX) used by the combat simulator. Skills follow the handout's category list; base chances are in the BRP rulebook, so skill defaults are 0 and the required 'attributes' field records a primary characteristic for reference only. Check types use the native percentile mechanics: roll_under_d100 (Critical <= stat/20, Special <= stat/5, Success <= stat, skill-dependent fumble band) for characteristics, Luck, Sanity and every skill; resistance_roll for the Resistance Table (chance = 50 + 5 x (active - passive); the brp_resistance_* checks cover the same-characteristic pairs); and opposed_roll_under_d100 for combat (brp_combat), which models the Attack and Defense Matrix hit rule (the attacker hits only with a strictly higher success level; equal levels mean the defender parries). BRP's Easy/Difficult difficulty levels (double/halve the skill) are modelled via CheckParams::difficultyMode, and flat +/-20% situational modifiers via CheckParams::difficulty. Data transcribes the handout's reference tables: sample poisons, the magic spell summary, the sorcery spell summary (by category), the psychic abilities and superpower summaries, the random mutation table (adverse mutations flagged), the chaotic features table, the combat fumble tables, the major wound table, the damage modifier table, the personality trait pairs, the reputation gains and observer modifiers, and the temporary insanity tables. Items are a representative weapon/armour set and the archetype is an illustrative average human. The weapon/armour tables themselves and the optional hit-location table are not transcribed as data records.",
  "namespace": "rpg_os::generated::brp_ugc",
  "attributes": [
    {
      "id": "STR",
      "name": "Strength",
      "min": 1,
      "max": 24,
      "default": 10
    },
    {
      "id": "CON",
      "name": "Constitution",
      "min": 1,
      "max": 24,
      "default": 10
    },
    {
      "id": "SIZ",
      "name": "Size",
      "min": 1,
      "max": 24,
      "default": 10
    },
    {
      "id": "INT",
      "name": "Intelligence",
      "min": 1,
      "max": 24,
      "default": 10
    },
    {
      "id": "POW",
      "name": "Power",
      "min": 1,
      "max": 24,
      "default": 10
    },
    {
      "id": "DEX",
      "name": "Dexterity",
      "min": 1,
      "max": 24,
      "default": 10
    },
    {
      "id": "APP",
      "name": "Appearance",
      "min": 1,
      "max": 24,
      "default": 10
    },
    {
      "id": "EDU",
      "name": "Education",
      "min": 1,
      "max": 24,
      "default": 10
    },
    {
      "id": "Luck",
      "name": "Luck",
      "min": 0,
      "max": 100,
      "default": 50
    },
    {
      "id": "Sanity",
      "name": "Sanity",
      "min": 0,
      "max": 100,
      "default": 50
    }
  ],
  "derived_stats": [
    {
      "id": "HitPoints_Max",
      "name": "Max Hit Points",
      "formula": "ceil((CON + SIZ) / 2)"
    },
    {
      "id": "PowerPoints_Max",
      "name": "Max Power Points",
      "formula": "POW"
    },
    {
      "id": "STR_5",
      "name": "Strength x5",
      "formula": "STR * 5"
    },
    {
      "id": "CON_5",
      "name": "Constitution x5",
      "formula": "CON * 5"
    },
    {
      "id": "SIZ_5",
      "name": "Size x5",
      "formula": "SIZ * 5"
    },
    {
      "id": "INT_5",
      "name": "Intelligence x5",
      "formula": "INT * 5"
    },
    {
      "id": "POW_5",
      "name": "Power x5",
      "formula": "POW * 5"
    },
    {
      "id": "DEX_5",
      "name": "Dexterity x5",
      "formula": "DEX * 5"
    },
    {
      "id": "APP_5",
      "name": "Appearance x5",
      "formula": "APP * 5"
    },
    {
      "id": "EDU_5",
      "name": "Education x5",
      "formula": "EDU * 5"
    },
    {
      "id": "Attack",
      "name": "Attack",
      "formula": "brawl"
    },
    {
      "id": "Parry",
      "name": "Parry Defense",
      "formula": "dodge"
    },
    {
      "id": "Initiative",
      "name": "Initiative",
      "formula": "DEX"
    }
  ],
  "resource_pools": [
    {
      "id": "HP",
      "name": "Hit Points",
      "max_stat": "HitPoints_Max",
      "min": 0
    },
    {
      "id": "PP",
      "name": "Power Points",
      "max_stat": "PowerPoints_Max",
      "min": 0
    }
  ],
  "skills": [
    {
      "id": "artillery",
      "name": "Artillery",
      "attributes": [
        "STR"
      ],
      "default": 0
    },
    {
      "id": "brawl",
      "name": "Brawl",
      "attributes": [
        "DEX"
      ],
      "default": 0
    },
    {
      "id": "energy_weapon",
      "name": "Energy Weapon",
      "attributes": [
        "DEX"
      ],
      "default": 0
    },
    {
      "id": "firearm",
      "name": "Firearm",
      "attributes": [
        "DEX"
      ],
      "default": 0
    },
    {
      "id": "grapple",
      "name": "Grapple",
      "attributes": [
        "DEX"
      ],
      "default": 0
    },
    {
      "id": "heavy_weapon",
      "name": "Heavy Weapon",
      "attributes": [
        "STR"
      ],
      "default": 0
    },
    {
      "id": "martial_arts",
      "name": "Martial Arts",
      "attributes": [
        "DEX"
      ],
      "default": 0
    },
    {
      "id": "melee_weapon",
      "name": "Melee Weapon",
      "attributes": [
        "DEX"
      ],
      "default": 0
    },
    {
      "id": "missile_weapon",
      "name": "Missile Weapon",
      "attributes": [
        "DEX"
      ],
      "default": 0
    },
    {
      "id": "parry",
      "name": "Parry",
      "attributes": [
        "DEX"
      ],
      "default": 0
    },
    {
      "id": "shield",
      "name": "Shield",
      "attributes": [
        "STR"
      ],
      "default": 0
    },
    {
      "id": "bargain",
      "name": "Bargain",
      "attributes": [
        "INT"
      ],
      "default": 0
    },
    {
      "id": "command",
      "name": "Command",
      "attributes": [
        "POW"
      ],
      "default": 0
    },
    {
      "id": "disguise",
      "name": "Disguise",
      "attributes": [
        "INT"
      ],
      "default": 0
    },
    {
      "id": "etiquette",
      "name": "Etiquette",
      "attributes": [
        "INT"
      ],
      "default": 0
    },
    {
      "id": "fast_talk",
      "name": "Fast Talk",
      "attributes": [
        "INT"
      ],
      "default": 0
    },
    {
      "id": "language",
      "name": "Language",
      "attributes": [
        "INT"
      ],
      "default": 0
    },
    {
      "id": "perform",
      "name": "Perform",
      "attributes": [
        "APP"
      ],
      "default": 0
    },
    {
      "id": "persuade",
      "name": "Persuade",
      "attributes": [
        "POW"
      ],
      "default": 0
    },
    {
      "id": "status",
      "name": "Status",
      "attributes": [
        "POW"
      ],
      "default": 0
    },
    {
      "id": "teach",
      "name": "Teach",
      "attributes": [
        "INT"
      ],
      "default": 0
    },
    {
      "id": "art",
      "name": "Art",
      "attributes": [
        "DEX"
      ],
      "default": 0
    },
    {
      "id": "craft",
      "name": "Craft",
      "attributes": [
        "DEX"
      ],
      "default": 0
    },
    {
      "id": "demolition",
      "name": "Demolition",
      "attributes": [
        "INT"
      ],
      "default": 0
    },
    {
      "id": "fine_manipulation",
      "name": "Fine Manipulation",
      "attributes": [
        "DEX"
      ],
      "default": 0
    },
    {
      "id": "heavy_machine",
      "name": "Heavy Machine",
      "attributes": [
        "DEX"
      ],
      "default": 0
    },
    {
      "id": "repair",
      "name": "Repair",
      "attributes": [
        "INT"
      ],
      "default": 0
    },
    {
      "id": "sleight_of_hand",
      "name": "Sleight of Hand",
      "attributes": [
        "DEX"
      ],
      "default": 0
    },
    {
      "id": "appraise",
      "name": "Appraise",
      "attributes": [
        "INT"
      ],
      "default": 0
    },
    {
      "id": "first_aid",
      "name": "First Aid",
      "attributes": [
        "INT"
      ],
      "default": 0
    },
    {
      "id": "gaming",
      "name": "Gaming",
      "attributes": [
        "INT"
      ],
      "default": 0
    },
    {
      "id": "knowledge",
      "name": "Knowledge",
      "attributes": [
        "INT"
      ],
      "default": 0
    },
    {
      "id": "literacy",
      "name": "Literacy",
      "attributes": [
        "INT"
      ],
      "default": 0
    },
    {
      "id": "medicine",
      "name": "Medicine",
      "attributes": [
        "INT"
      ],
      "default": 0
    },
    {
      "id": "psychotherapy",
      "name": "Psychotherapy",
      "attributes": [
        "INT"
      ],
      "default": 0
    },
    {
      "id": "science",
      "name": "Science",
      "attributes": [
        "INT"
      ],
      "default": 0
    },
    {
      "id": "strategy",